question_base,question_type,columns_count,columns,options_count,all_options,sample_columns
"4.5 Nel CPIA in cui presta servizio, attualmente si forniscono agli studenti istruzioni per",multiple_choice,7,"4.5 Nel CPIA in cui presta servizio, attualmente si forniscono agli studenti istruzioni per [accedere a informazioni relative a offerte di lavoro, stage, tirocini attraverso canali tradizionali (uffici preposti; incontri in presenza nelle scuole o nelle università; meeting con aziende etc.)]; 4.5 Nel CPIA in cui presta servizio, attualmente si forniscono agli studenti istruzioni per [navigare in banche dati per accedere a informazioni relative a offerte di lavoro, stage, tirocini (siti specifici del MIM; siti delle scuole; siti delle università; siti dedicati al matching; siti delle aziende etc.)]; 4.5 Nel CPIA in cui presta servizio, attualmente si forniscono agli studenti istruzioni per [elaborare un CV utilizzando i formati europei in lingua italiana]; 4.5 Nel CPIA in cui presta servizio, attualmente si forniscono agli studenti istruzioni per [elaborare un CV utilizzando i formati europei in lingua inglese]; 4.5 Nel CPIA in cui presta servizio, attualmente si forniscono agli studenti istruzioni per [elaborare una lettera di presentazione in lingua italiana]; 4.5 Nel CPIA in cui presta servizio, attualmente si forniscono agli studenti istruzioni per [elaborare una lettera di presentazione in lingua inglese]; 4.5 Nel CPIA in cui presta servizio, attualmente si forniscono agli studenti istruzioni per [elaborare un CV amplificato utilizzando l’ePortfolio ]",13,"accedere a informazioni relative a offerte di lavoro, stage, tirocini attraverso canali tradizionali (uffici preposti; incontri in presenza nelle scuole o nelle università; meeting con aziende etc.); navigare in banche dati per accedere a informazioni relative a offerte di lavoro, stage, tirocini (siti specifici del MIM; siti delle scuole; siti delle università; siti dedicati al matching; siti delle aziende etc.); elaborare un CV utilizzando i formati europei in lingua italiana; elaborare un CV utilizzando i formati europei in lingua inglese; elaborare una lettera di presentazione in lingua italiana; elaborare una lettera di presentazione in lingua inglese; elaborare un CV amplificato utilizzando l’ePortfolio","['4.5 Nel CPIA in cui presta servizio, attualmente si forniscono agli studenti istruzioni per [accedere a informazioni relative a offerte di lavoro, stage, tirocini attraverso canali tradizionali (uffici preposti; incontri in presenza nelle scuole o nelle università; meeting con aziende etc.)]', '4.5 Nel CPIA in cui presta servizio, attualmente si forniscono agli studenti istruzioni per [navigare in banche dati per accedere a informazioni relative a offerte di lavoro, stage, tirocini (siti specifici del MIM; siti delle scuole; siti delle università; siti dedicati al matching; siti delle aziende etc.)]', '4.5 Nel CPIA in cui presta servizio, attualmente si forniscono agli studenti istruzioni per [elaborare un CV utilizzando i formati europei in lingua italiana]', '4.5 Nel CPIA in cui presta servizio, attualmente si forniscono agli studenti istruzioni per [elaborare un CV utilizzando i formati europei in lingua inglese]', '4.5 Nel CPIA in cui presta servizio, attualmente si forniscono agli studenti istruzioni per [elaborare una lettera di presentazione in lingua italiana]']"
"4.6 Per migliorare le capacità di orientamento, ritiene che il CPIA in cui presta servizio dovrebbe fornire agli studenti strumenti per",multiple_choice,7,"4.6 Per migliorare le capacità di orientamento, ritiene che il CPIA in cui presta servizio dovrebbe fornire agli studenti strumenti per [accedere a informazioni relative a offerte di lavoro, stage, tirocini attraverso canali tradizionali (uffici preposti; incontri in presenza nelle scuole o nelle università; meeting con aziende etc)]; 4.6 Per migliorare le capacità di orientamento, ritiene che il CPIA in cui presta servizio dovrebbe fornire agli studenti strumenti per [navigare in banche dati per accedere a informazioni relative a offerte di lavoro, stage, tirocini (siti specifici del MIM; siti delle scuole; siti delle università; siti dedicati al matching; siti delle aziende etc.)]; 4.6 Per migliorare le capacità di orientamento, ritiene che il CPIA in cui presta servizio dovrebbe fornire agli studenti strumenti per [elaborare un CV utilizzando i formati europei in lingua italiana]; 4.6 Per migliorare le capacità di orientamento, ritiene che il CPIA in cui presta servizio dovrebbe fornire agli studenti strumenti per [elaborare un CV utilizzando i formati europei in lingua inglese]; 4.6 Per migliorare le capacità di orientamento, ritiene che il CPIA in cui presta servizio dovrebbe fornire agli studenti strumenti per [elaborare una lettera di presentazione in lingua italiana]; 4.6 Per migliorare le capacità di orientamento, ritiene che il CPIA in cui presta servizio dovrebbe fornire agli studenti strumenti per [elaborare una lettera di presentazione in lingua inglese]; 4.6 Per migliorare le capacità di orientamento, ritiene che il CPIA in cui presta servizio dovrebbe fornire agli studenti strumenti per [elaborare un CV amplificato utilizzando l’ePortfolio ]",13,"accedere a informazioni relative a offerte di lavoro, stage, tirocini attraverso canali tradizionali (uffici preposti; incontri in presenza nelle scuole o nelle università; meeting con aziende etc); navigare in banche dati per accedere a informazioni relative a offerte di lavoro, stage, tirocini (siti specifici del MIM; siti delle scuole; siti delle università; siti dedicati al matching; siti delle aziende etc.); elaborare un CV utilizzando i formati europei in lingua italiana; elaborare un CV utilizzando i formati europei in lingua inglese; elaborare una lettera di presentazione in lingua italiana; elaborare una lettera di presentazione in lingua inglese; elaborare un CV amplificato utilizzando l’ePortfolio","['4.6 Per migliorare le capacità di orientamento, ritiene che il CPIA in cui presta servizio dovrebbe fornire agli studenti strumenti per [accedere a informazioni relative a offerte di lavoro, stage, tirocini attraverso canali tradizionali (uffici preposti; incontri in presenza nelle scuole o nelle università; meeting con aziende etc)]', '4.6 Per migliorare le capacità di orientamento, ritiene che il CPIA in cui presta servizio dovrebbe fornire agli studenti strumenti per [navigare in banche dati per accedere a informazioni relative a offerte di lavoro, stage, tirocini (siti specifici del MIM; siti delle scuole; siti delle università; siti dedicati al matching; siti delle aziende etc.)]', '4.6 Per migliorare le capacità di orientamento, ritiene che il CPIA in cui presta servizio dovrebbe fornire agli studenti strumenti per [elaborare un CV utilizzando i formati europei in lingua italiana]', '4.6 Per migliorare le capacità di orientamento, ritiene che il CPIA in cui presta servizio dovrebbe fornire agli studenti strumenti per [elaborare un CV utilizzando i formati europei in lingua inglese]', '4.6 Per migliorare le capacità di orientamento, ritiene che il CPIA in cui presta servizio dovrebbe fornire agli studenti strumenti per [elaborare una lettera di presentazione in lingua italiana]']"
"4.7 Indicare i profili professionali del CPIA impegnati nelle attività di orientamento, specificando per ciascun profilo il numero delle figure presenti (se un profilo non è rappresentato, indicare 'zero'). Nel campo 'Altro (specificare)', elencare i profili distinti separandoli con il punto e virgola, indicando per ciascuno il relativo numero.",multiple_choice,5,"4.7 Indicare i profili professionali del CPIA impegnati nelle attività di orientamento, specificando per ciascun profilo il numero delle figure presenti (se un profilo non è rappresentato, indicare 'zero'). Nel campo 'Altro (specificare)', elencare i profili distinti separandoli con il punto e virgola, indicando per ciascuno il relativo numero.  [Docente referente per l'accoglienza e orientamento]; 4.7 Indicare i profili professionali del CPIA impegnati nelle attività di orientamento, specificando per ciascun profilo il numero delle figure presenti (se un profilo non è rappresentato, indicare 'zero'). Nel campo 'Altro (specificare)', elencare i profili distinti separandoli con il punto e virgola, indicando per ciascuno il relativo numero.  [Dirigente scolastico]; 4.7 Indicare i profili professionali del CPIA impegnati nelle attività di orientamento, specificando per ciascun profilo il numero delle figure presenti (se un profilo non è rappresentato, indicare 'zero'). Nel campo 'Altro (specificare)', elencare i profili distinti separandoli con il punto e virgola, indicando per ciascuno il relativo numero.  [Docente (non referente per l'orientamento)]; 4.7 Indicare i profili professionali del CPIA impegnati nelle attività di orientamento, specificando per ciascun profilo il numero delle figure presenti (se un profilo non è rappresentato, indicare 'zero'). Nel campo 'Altro (specificare)', elencare i profili distinti separandoli con il punto e virgola, indicando per ciascuno il relativo numero.  [Personale TAB]; 4.7 Indicare i profili professionali del CPIA impegnati nelle attività di orientamento, specificando per ciascun profilo il numero delle figure presenti (se un profilo non è rappresentato, indicare 'zero'). Nel campo 'Altro (specificare)', elencare i profili distinti separandoli con il punto e virgola, indicando per ciascuno il relativo numero.  [Altro (specificare)]",5,Docente referente per l'accoglienza e orientamento; Dirigente scolastico; Docente (non referente per l'orientamento); Personale TAB; Altro (specificare),"[""4.7 Indicare i profili professionali del CPIA impegnati nelle attività di orientamento, specificando per ciascun profilo il numero delle figure presenti (se un profilo non è rappresentato, indicare 'zero'). Nel campo 'Altro (specificare)', elencare i profili distinti separandoli con il punto e virgola, indicando per ciascuno il relativo numero.  [Docente referente per l'accoglienza e orientamento]"", ""4.7 Indicare i profili professionali del CPIA impegnati nelle attività di orientamento, specificando per ciascun profilo il numero delle figure presenti (se un profilo non è rappresentato, indicare 'zero'). Nel campo 'Altro (specificare)', elencare i profili distinti separandoli con il punto e virgola, indicando per ciascuno il relativo numero.  [Dirigente scolastico]"", ""4.7 Indicare i profili professionali del CPIA impegnati nelle attività di orientamento, specificando per ciascun profilo il numero delle figure presenti (se un profilo non è rappresentato, indicare 'zero'). Nel campo 'Altro (specificare)', elencare i profili distinti separandoli con il punto e virgola, indicando per ciascuno il relativo numero.  [Docente (non referente per l'orientamento)]"", ""4.7 Indicare i profili professionali del CPIA impegnati nelle attività di orientamento, specificando per ciascun profilo il numero delle figure presenti (se un profilo non è rappresentato, indicare 'zero'). Nel campo 'Altro (specificare)', elencare i profili distinti separandoli con il punto e virgola, indicando per ciascuno il relativo numero.  [Personale TAB]"", ""4.7 Indicare i profili professionali del CPIA impegnati nelle attività di orientamento, specificando per ciascun profilo il numero delle figure presenti (se un profilo non è rappresentato, indicare 'zero'). Nel campo 'Altro (specificare)', elencare i profili distinti separandoli con il punto e virgola, indicando per ciascuno il relativo numero.  [Altro (specificare)]""]"
5.1 Le pratiche di orientamento sviluppate dal CPIA in cui presta servizio prevedono,multiple_choice,10,5.1 Le pratiche di orientamento sviluppate dal CPIA in cui presta servizio prevedono  [incontri con le aziende locali e del territorio]; 5.1 Le pratiche di orientamento sviluppate dal CPIA in cui presta servizio prevedono  [attivazione di PCTO presso le aziende locali e del territorio]; 5.1 Le pratiche di orientamento sviluppate dal CPIA in cui presta servizio prevedono  [attivazione di tirocini e/o stage presso le aziende locali e del territorio]; 5.1 Le pratiche di orientamento sviluppate dal CPIA in cui presta servizio prevedono  [organizzazione di visite didattiche presso le aziende locali e del territorio]; 5.1 Le pratiche di orientamento sviluppate dal CPIA in cui presta servizio prevedono  [partecipazione a progetti in collaborazione con le aziende locali e del territorio]; 5.1 Le pratiche di orientamento sviluppate dal CPIA in cui presta servizio prevedono  [incontri con rappresentanti delle istituzioni locali]; 5.1 Le pratiche di orientamento sviluppate dal CPIA in cui presta servizio prevedono  [incontri con gli operatori dei centri per l’orientamento e/o per l’impiego]; 5.1 Le pratiche di orientamento sviluppate dal CPIA in cui presta servizio prevedono  [attivazione di tirocini e/o stage presso le istituzioni locali]; 5.1 Le pratiche di orientamento sviluppate dal CPIA in cui presta servizio prevedono  [organizzazione di visite didattiche presso le istituzioni locali]; 5.1 Le pratiche di orientamento sviluppate dal CPIA in cui presta servizio prevedono  [partecipazione a progetti in collaborazione con le istituzioni locali],10,incontri con le aziende locali e del territorio; attivazione di PCTO presso le aziende locali e del territorio; attivazione di tirocini e/o stage presso le aziende locali e del territorio; organizzazione di visite didattiche presso le aziende locali e del territorio; partecipazione a progetti in collaborazione con le aziende locali e del territorio; incontri con rappresentanti delle istituzioni locali; incontri con gli operatori dei centri per l’orientamento e/o per l’impiego; attivazione di tirocini e/o stage presso le istituzioni locali; organizzazione di visite didattiche presso le istituzioni locali; partecipazione a progetti in collaborazione con le istituzioni locali,"['5.1 Le pratiche di orientamento sviluppate dal CPIA in cui presta servizio prevedono\xa0 [incontri con le aziende locali e del territorio]', '5.1 Le pratiche di orientamento sviluppate dal CPIA in cui presta servizio prevedono\xa0 [attivazione di PCTO presso le aziende locali e del territorio]', '5.1 Le pratiche di orientamento sviluppate dal CPIA in cui presta servizio prevedono\xa0 [attivazione di tirocini e/o stage presso le aziende locali e del territorio]', '5.1 Le pratiche di orientamento sviluppate dal CPIA in cui presta servizio prevedono\xa0 [organizzazione di visite didattiche presso le aziende locali e del territorio]', '5.1 Le pratiche di orientamento sviluppate dal CPIA in cui presta servizio prevedono\xa0 [partecipazione a progetti in collaborazione con le aziende locali e del territorio]']"
"5.2 Per la creazione di una rete territoriale per l’orientamento, il CPIA in cui presta servizio prevede",multiple_choice,5,"5.2 Per la creazione di una rete territoriale per l’orientamento, il CPIA in cui presta servizio prevede  [lo sviluppo di piattaforme digitali che coinvolgano scuole, aziende e istituzioni del territorio]; 5.2 Per la creazione di una rete territoriale per l’orientamento, il CPIA in cui presta servizio prevede  [incontri in presenza con scuole, aziende e istituzioni del territorio]; 5.2 Per la creazione di una rete territoriale per l’orientamento, il CPIA in cui presta servizio prevede  [incontri online con scuole, aziende e istituzioni del territorio]; 5.2 Per la creazione di una rete territoriale per l’orientamento, il CPIA in cui presta servizio prevede  [scambio di esperienze tra le scuole del territorio di ogni ordine e grado]; 5.2 Per la creazione di una rete territoriale per l’orientamento, il CPIA in cui presta servizio prevede  [elaborazione e realizzazione di progetti tra le scuole del territorio di ogni ordine e grado]",5,"lo sviluppo di piattaforme digitali che coinvolgano scuole, aziende e istituzioni del territorio; incontri in presenza con scuole, aziende e istituzioni del territorio; incontri online con scuole, aziende e istituzioni del territorio; scambio di esperienze tra le scuole del territorio di ogni ordine e grado; elaborazione e realizzazione di progetti tra le scuole del territorio di ogni ordine e grado","['5.2 Per la creazione di una rete territoriale per l’orientamento, il CPIA in cui presta servizio prevede\xa0 [lo sviluppo di piattaforme digitali che coinvolgano scuole, aziende e istituzioni del territorio]', '5.2 Per la creazione di una rete territoriale per l’orientamento, il CPIA in cui presta servizio prevede\xa0 [incontri in presenza con scuole, aziende e istituzioni del territorio]', '5.2 Per la creazione di una rete territoriale per l’orientamento, il CPIA in cui presta servizio prevede\xa0 [incontri online con scuole, aziende e istituzioni del territorio]', '5.2 Per la creazione di una rete territoriale per l’orientamento, il CPIA in cui presta servizio prevede\xa0 [scambio di esperienze tra le scuole del territorio di ogni ordine e grado]', '5.2 Per la creazione di una rete territoriale per l’orientamento, il CPIA in cui presta servizio prevede\xa0 [elaborazione e realizzazione di progetti tra le scuole del territorio di ogni ordine e grado]']"
6.1 Nel CPIA in cui presta servizio è presente un sistema di monitoraggio delle azioni di orientamento?,multiple_choice,2,6.1 Nel CPIA in cui presta servizio è presente un sistema di monitoraggio delle azioni di orientamento? ; 6.1 Nel CPIA in cui presta servizio è presente un sistema di monitoraggio delle azioni di orientamento? ,2,No; Sì,"['6.1 Nel CPIA in cui presta servizio è presente un sistema di monitoraggio delle azioni di orientamento? ', '6.1 Nel CPIA in cui presta servizio è presente un sistema di monitoraggio delle azioni di orientamento? ']"
6.2 Chi se ne occupa?,multiple_choice,5,6.2 Chi se ne occupa?  [il dirigente scolastico]; 6.2 Chi se ne occupa?  [il docente che si occupa dell’accoglienza e dell’orientamento]; 6.2 Chi se ne occupa?  [il docente che si occupa dell’accoglienza e dell’orientamento affiancato dai docenti dei consigli di livello]; 6.2 Chi se ne occupa?  [esperto esterno]; 6.2 Chi se ne occupa?  [Altro],5,il dirigente scolastico; il docente che si occupa dell’accoglienza e dell’orientamento; il docente che si occupa dell’accoglienza e dell’orientamento affiancato dai docenti dei consigli di livello; esperto esterno; Altro,"['6.2 Chi se ne occupa?\xa0 [il dirigente scolastico]', '6.2 Chi se ne occupa?\xa0 [il docente che si occupa dell’accoglienza e dell’orientamento]', '6.2 Chi se ne occupa?\xa0 [il docente che si occupa dell’accoglienza e dell’orientamento affiancato dai docenti dei consigli di livello]', '6.2 Chi se ne occupa?\xa0 [esperto esterno]', '6.2 Chi se ne occupa?\xa0 [Altro]']"
6.3 Quali attività di orientamento sono oggetto di monitoraggio?,multiple_choice,16,"6.3 Quali attività di orientamento sono oggetto di monitoraggio? [Gli interventi formativi/informativi effettuati in ambito scolastico (rilevazione sistematica del gradimento degli interventi in aula o in istituto da parte di esperti esterni o dei docenti tutor etc.)]; 6.3 Quali attività di orientamento sono oggetto di monitoraggio? [Gli interventi formativi/informativi effettuati in ambito extrascolastico (rilevazione sistematica del gradimento della partecipazione ad eventi organizzati dalle università o da istituzioni per la formazione di terzo livello etc.)]; 6.3 Quali attività di orientamento sono oggetto di monitoraggio? [La partecipazione degli studenti agli interventi effettuati nel CPIA (rilevazione sistematica del numero di CV compilati, numero di siti online visitati, partecipazione attiva ai dibattiti etc.)]; 6.3 Quali attività di orientamento sono oggetto di monitoraggio? [La partecipazione degli studenti agli interventi effettuati all’esterno del CPIA (rilevazione sistematica del numero di stand visitati nelle fiere, numero di partecipanti agli Open Day, numero partecipanti ai PCTO, restituzione attiva in classe delle esperienze effettuate etc.)]; 6.3 Quali attività di orientamento sono oggetto di monitoraggio? [La redazione del consiglio di orientamento (rilevazione del grado di accordo delle figure parentali/educative/tutoriali etc.)]; 6.3 Quali attività di orientamento sono oggetto di monitoraggio? [La redazione del curriculum dello studente (rilevazione del grado di accordo delle figure parentali/educative/tutoriali etc.)]; 6.3 Quali attività di orientamento sono oggetto di monitoraggio? [La compilazione dell’ePortfolio disponibile sulla piattaforma UNICA del MIM]; 6.3 Quali attività di orientamento sono oggetto di monitoraggio? [La compilazione del Dossier personale dell’IDA]; 6.3 Quali attività di orientamento sono oggetto di monitoraggio? [La definizione del Patto formativo individuale]; 6.3 Quali attività di orientamento sono oggetto di monitoraggio? [Il percorso di riconoscimento dei crediti ]; 6.3 Quali attività di orientamento sono oggetto di monitoraggio? [Il periodo didattico dedicato alle attività di “Accoglienza e Orientamento”]; 6.3 Quali attività di orientamento sono oggetto di monitoraggio? [La partecipazione delle istituzioni locali alle attività di orientamento presso il CPIA (numero e qualità degli interventi di ASL, biblioteche, centri per l’orientamento, centri per l’impiego etc.)]; 6.3 Quali attività di orientamento sono oggetto di monitoraggio? [La partecipazione delle aziende locali alle attività di orientamento presso il CPIA (numero e qualità degli interventi delle aziende etc.)]; 6.3 Quali attività di orientamento sono oggetto di monitoraggio? [La partecipazione delle figure parentali/educative/tutoriali alle attività di orientamento presso il CPIA (numero e qualità degli interventi etc.)]; 6.3 Quali attività di orientamento sono oggetto di monitoraggio? [La verifica della coerenza tra le attività svolte e gli obiettivi del PTOF]; 6.3 Quali attività di orientamento sono oggetto di monitoraggio? [L’utilizzo del RAV per l’individuazione dei fattori da rilevare, dei punti di forza e criticità, delle azioni di miglioramento]",16,"Gli interventi formativi/informativi effettuati in ambito scolastico (rilevazione sistematica del gradimento degli interventi in aula o in istituto da parte di esperti esterni o dei docenti tutor etc.); Gli interventi formativi/informativi effettuati in ambito extrascolastico (rilevazione sistematica del gradimento della partecipazione ad eventi organizzati dalle università o da istituzioni per la formazione di terzo livello etc.); La partecipazione degli studenti agli interventi effettuati nel CPIA (rilevazione sistematica del numero di CV compilati, numero di siti online visitati, partecipazione attiva ai dibattiti etc.); La partecipazione degli studenti agli interventi effettuati all’esterno del CPIA (rilevazione sistematica del numero di stand visitati nelle fiere, numero di partecipanti agli Open Day, numero partecipanti ai PCTO, restituzione attiva in classe delle esperienze effettuate etc.); La redazione del consiglio di orientamento (rilevazione del grado di accordo delle figure parentali/educative/tutoriali etc.); La redazione del curriculum dello studente (rilevazione del grado di accordo delle figure parentali/educative/tutoriali etc.); La compilazione dell’ePortfolio disponibile sulla piattaforma UNICA del MIM; La compilazione del Dossier personale dell’IDA; La definizione del Patto formativo individuale; Il percorso di riconoscimento dei crediti; Il periodo didattico dedicato alle attività di “Accoglienza e Orientamento”; La partecipazione delle istituzioni locali alle attività di orientamento presso il CPIA (numero e qualità degli interventi di ASL, biblioteche, centri per l’orientamento, centri per l’impiego etc.); La partecipazione delle aziende locali alle attività di orientamento presso il CPIA (numero e qualità degli interventi delle aziende etc.); La partecipazione delle figure parentali/educative/tutoriali alle attività di orientamento presso il CPIA (numero e qualità degli interventi etc.); La verifica della coerenza tra le attività svolte e gli obiettivi del PTOF; L’utilizzo del RAV per l’individuazione dei fattori da rilevare, dei punti di forza e criticità, delle azioni di miglioramento","['6.3 Quali attività di orientamento sono oggetto di monitoraggio? [Gli interventi formativi/informativi effettuati in ambito scolastico (rilevazione sistematica del gradimento degli interventi in aula o in istituto da parte di esperti esterni o dei docenti tutor etc.)]', '6.3 Quali attività di orientamento sono oggetto di monitoraggio? [Gli interventi formativi/informativi effettuati in ambito extrascolastico (rilevazione sistematica del gradimento della partecipazione ad eventi organizzati dalle università o da istituzioni per la formazione di terzo livello etc.)]', '6.3 Quali attività di orientamento sono oggetto di monitoraggio? [La partecipazione degli studenti agli interventi effettuati nel CPIA (rilevazione sistematica del numero di CV compilati, numero di siti online visitati, partecipazione attiva ai dibattiti etc.)]', '6.3 Quali attività di orientamento sono oggetto di monitoraggio? [La partecipazione degli studenti agli interventi effettuati all’esterno del CPIA (rilevazione sistematica del numero di stand visitati nelle fiere, numero di partecipanti agli Open Day, numero partecipanti ai PCTO, restituzione attiva in classe delle esperienze effettuate etc.)]', '6.3 Quali attività di orientamento sono oggetto di monitoraggio? [La redazione del consiglio di orientamento (rilevazione del grado di accordo delle figure parentali/educative/tutoriali etc.)]']"
